{
  "cases": [
    {
      "case_id": "levels-by-kind-and-unknown-kind",
      "expected": {
        "final_state": {
          "members": [
            {
              "known": true,
              "ping_level": "essential",
              "user_id": "1"
            },
            {
              "known": true,
              "ping_level": "all",
              "user_id": "2"
            },
            {
              "known": true,
              "ping_level": "off",
              "user_id": "3"
            }
          ]
        },
        "steps": [
          {
            "value": {
              "essential": [
                "countdown",
                "day_of",
                "decline",
                "proposal"
              ],
              "informational": [
                "amend",
                "digest",
                "fixed",
                "rescan",
                "retract",
                "status",
                "swap",
                "test"
              ]
            }
          },
          {
            "value": [
              "1",
              "2"
            ]
          },
          {
            "value": [
              "1",
              "2"
            ]
          },
          {
            "value": [
              "1",
              "2"
            ]
          },
          {
            "value": [
              "1",
              "2"
            ]
          },
          {
            "value": [
              "2"
            ]
          },
          {
            "value": [
              "2"
            ]
          },
          {
            "value": [
              "2"
            ]
          },
          {
            "value": [
              "2"
            ]
          },
          {
            "value": [
              "2"
            ]
          },
          {
            "value": [
              "2"
            ]
          },
          {
            "value": [
              "2"
            ]
          },
          {
            "value": [
              "2"
            ]
          },
          {
            "value": [
              "2"
            ]
          },
          {
            "value": false
          },
          {
            "value": false
          },
          {
            "value": false
          },
          {
            "value": true
          },
          {
            "value": false
          },
          {
            "value": false
          },
          {
            "value": true
          },
          {
            "value": true
          },
          {
            "value": true
          }
        ]
      },
      "input": {
        "clock": "2026-08-27T01:00:00+08:00",
        "members": [
          {
            "display_name": "Alvin tan",
            "has_role": true,
            "nickname": null,
            "ping_level": "essential",
            "user_id": "1"
          },
          {
            "display_name": "kanon [AZUR]",
            "has_role": true,
            "nickname": "kanon",
            "ping_level": "all",
            "user_id": "2"
          },
          {
            "display_name": "Priya",
            "has_role": true,
            "nickname": null,
            "ping_level": "off",
            "user_id": "3"
          }
        ],
        "steps": [
          {
            "op": "ping_kinds"
          },
          {
            "candidates": [
              "1",
              "2",
              "3"
            ],
            "kind": "day_of",
            "op": "resolve_mentions"
          },
          {
            "candidates": [
              "1",
              "2",
              "3"
            ],
            "kind": "countdown",
            "op": "resolve_mentions"
          },
          {
            "candidates": [
              "1",
              "2",
              "3"
            ],
            "kind": "proposal",
            "op": "resolve_mentions"
          },
          {
            "candidates": [
              "1",
              "2",
              "3"
            ],
            "kind": "decline",
            "op": "resolve_mentions"
          },
          {
            "candidates": [
              "1",
              "2",
              "3"
            ],
            "kind": "amend",
            "op": "resolve_mentions"
          },
          {
            "candidates": [
              "1",
              "2",
              "3"
            ],
            "kind": "status",
            "op": "resolve_mentions"
          },
          {
            "candidates": [
              "1",
              "2",
              "3"
            ],
            "kind": "swap",
            "op": "resolve_mentions"
          },
          {
            "candidates": [
              "1",
              "2",
              "3"
            ],
            "kind": "fixed",
            "op": "resolve_mentions"
          },
          {
            "candidates": [
              "1",
              "2",
              "3"
            ],
            "kind": "digest",
            "op": "resolve_mentions"
          },
          {
            "candidates": [
              "1",
              "2",
              "3"
            ],
            "kind": "retract",
            "op": "resolve_mentions"
          },
          {
            "candidates": [
              "1",
              "2",
              "3"
            ],
            "kind": "rescan",
            "op": "resolve_mentions"
          },
          {
            "candidates": [
              "1",
              "2",
              "3"
            ],
            "kind": "test",
            "op": "resolve_mentions"
          },
          {
            "candidates": [
              "1",
              "2",
              "3"
            ],
            "kind": "nonsense",
            "op": "resolve_mentions"
          },
          {
            "kind": "day_of",
            "level": "off",
            "op": "wants_mention"
          },
          {
            "kind": "swap",
            "level": "off",
            "op": "wants_mention"
          },
          {
            "kind": "nonsense",
            "level": "off",
            "op": "wants_mention"
          },
          {
            "kind": "day_of",
            "level": "essential",
            "op": "wants_mention"
          },
          {
            "kind": "swap",
            "level": "essential",
            "op": "wants_mention"
          },
          {
            "kind": "nonsense",
            "level": "essential",
            "op": "wants_mention"
          },
          {
            "kind": "day_of",
            "level": "all",
            "op": "wants_mention"
          },
          {
            "kind": "swap",
            "level": "all",
            "op": "wants_mention"
          },
          {
            "kind": "nonsense",
            "level": "all",
            "op": "wants_mention"
          }
        ],
        "timezone": "Asia/Kuala_Lumpur"
      }
    },
    {
      "case_id": "order-dedup-and-unknown-members",
      "expected": {
        "final_state": {
          "members": [
            {
              "known": true,
              "ping_level": "essential",
              "user_id": "1"
            },
            {
              "known": true,
              "ping_level": "all",
              "user_id": "2"
            },
            {
              "known": true,
              "ping_level": "off",
              "user_id": "3"
            }
          ]
        },
        "steps": [
          {
            "value": [
              "2",
              "1"
            ]
          },
          {
            "value": [
              "404",
              "1"
            ]
          },
          {
            "value": [
              "2"
            ]
          },
          {
            "value": []
          }
        ]
      },
      "input": {
        "clock": "2026-08-27T01:00:00+08:00",
        "members": [
          {
            "display_name": "Alvin tan",
            "has_role": true,
            "nickname": null,
            "ping_level": "essential",
            "user_id": "1"
          },
          {
            "display_name": "kanon [AZUR]",
            "has_role": true,
            "nickname": "kanon",
            "ping_level": "all",
            "user_id": "2"
          },
          {
            "display_name": "Priya",
            "has_role": true,
            "nickname": null,
            "ping_level": "off",
            "user_id": "3"
          }
        ],
        "steps": [
          {
            "candidates": [
              "2",
              "1",
              "2",
              1
            ],
            "kind": "day_of",
            "op": "resolve_mentions"
          },
          {
            "candidates": [
              "404",
              "1"
            ],
            "kind": "day_of",
            "op": "resolve_mentions"
          },
          {
            "candidates": [
              "404",
              "2"
            ],
            "kind": "amend",
            "op": "resolve_mentions"
          },
          {
            "candidates": [],
            "kind": "countdown",
            "op": "resolve_mentions"
          }
        ],
        "timezone": "Asia/Kuala_Lumpur"
      }
    },
    {
      "case_id": "audiences-per-post-kind",
      "expected": {
        "final_state": {
          "members": [
            {
              "known": true,
              "ping_level": "essential",
              "user_id": "1"
            },
            {
              "known": true,
              "ping_level": "all",
              "user_id": "2"
            },
            {
              "known": true,
              "ping_level": "off",
              "user_id": "3"
            }
          ]
        },
        "steps": [
          {
            "value": {
              "mentioned": [
                "2"
              ],
              "names": [
                [
                  "1",